{
  "type": "object",
  "$schema": "http://json-schema.org/schema",
  "properties": {
    "pricingID": {
      "type": "string"
    },
    "cost": {
      "type": "number",
      "description": "The final cost of the order after taxes, charges, and discounts have been applied."
    },
    "taxAmount": {
      "type": "number",
      "description": "The total tax charged to the order."
    },
    "discountAmount": {
      "type": "number",
      "description": "The total value of the discounts applied to the order."
    },
    "discounts": {
      "type": "array",
      "items": {
        "$ref": "discount.json"
      }
    },
    "orderItems": {
      "type": "array",
      "items": {
        "$ref": "orderItem.json"
      }
    }
  },
  "required": [
    "pricingID",
    "cost",
    "orderItems"
  ]
}