{
  "pricingID": "1",
  "cost": 258.96,
  "taxAmount": 21.3,
  "discountAmount": 32.5,
  "discounts": [
    {
      "discountID": "1",
      "discountAmount": 32.5
    }
  ],
  "orderItems": [
    {
      "orderItemID": "1",
      "cost": 270.16,
      "invoiceID": "1",
      "itemID": "55345",
      "itemCount": 10
    }
  ]
}